titulo;loja;fonte;preco;tem_imagem;tem_afiliado;hash
Geladeira Electrolux Frost Free 310L Duplex Cor Inox (TF39S);lebiscuit.com.br;Promobit;R$2.384,10;True;True;06e0b132e6edec5db9536335f8686402609221f0bcfbcdcd5e494bde1d47ae12
Relógio inteligente Amazfit Active 2 44mm Mapas GPS com direção Rastreador de fitness Bateria de 10 dias Monitor;aliexpress.com;Promobit;R$535,12;True;True;475969fadda2186ad58bab2d9745318e6fd1b27a00b028da10286848895bf69f
Desktop HP Pro SFF 280 G9 Intel Core i3 Windows 11 Home 4GB RAM;hp.com;Promobit;R$2.599,05;True;True;bfc20958d4ade63ffdfd8999f6adbd35f64ff813c38297660ff59ecd1ab240bd
Smart TV Samsung 50" Neo Qled 4K 2024 - 50QN90D;samsung.com;Promobit;R$3.365,10;True;True;08518bc462fcee171161eff19fa07ce47ecd8fb4e974aa5ecbdb9318fde73970
Descubra as nossas melhores ofertas e cupons exclusivos!;promobit.com.br;Promobit;R$15,19;True;True;bcd741d4f4622cc400a8c79c8bb6b2433eada269f2676094356a1335bbf0baad
Kit 3 Pares de Meias Light Não Atoalhado Cano Invisível Tamanho 34-38 Oxer Adulto;centauro.com.br;Promobit;R$15,19;True;True;05a168b7b24ac5db1d7028c877fd032cb36514c37b5a31d36e3d69fe9ecd61c9
Planos de Internet Móvel a Partir de R$58,99. Compare e Economize!;melhorplano.net;Promobit;R$58,99;True;True;e5c54148d92f2a5532e375f12f3e25a87ec24f3aac366a635c0c68a2df86611b
Smartphone Samsung Galaxy S25 Ultra 512GB 12GB Galaxy AI 5G 6.9";samsung.com;Promobit;R$6.002,10;True;True;5b31eca44a84fd2a1eb4bd7c3d03094dc67feb1086442025ff9dd4d70a8e0bbf
Cadeira Gamer Ninja Jiraya Preto;terabyteshop.com.br;Promobit;R$459,90;True;True;eacc1f2c4e0c9cb6a73b78fc7159afca007ed4b74475d007824a818ee7443524
Smartphone Samsung Galaxy S25 Ultra 256GB 12GB Galaxy AI 5G 6.9";samsung.com;Promobit;R$5.759,10;True;True;5a3d1a896bf0493a05592faa54d2923011eb5355fd22d657c9b6f37306e5db6d
Smart TV Samsung Vision AI TV 55" QLED 4K Q7F 2025 Pontos Quânticos - QN55Q7FAAGXZD;casasbahia.com.br;Promobit;R$2.899,00;True;True;abc7f54731599112fe308f006ff16d08a5f23b60ac4de56bdeeaad145c4adf73
Multiprocessador de Alimentos Mondial Turbo Chef 5 Funções 1000W - MPN-01-B;mercadolivre.com.br;Promobit;R$275,00;True;True;e0bafb950f6d86aa23e73311628ceb1af9b5922194a857e222d62f5c1e78cac9
Tênis Adidas Urban Court - Masculino;netshoes.com.br;Promobit;R$134,99;True;True;f797ef207da0044d860b80aefcc6a470eb950bbadf37209ba448e86833c08678
Mini Retífica Sem Fio Multiuso - Ferramenta Rotativa com 66 Acessórios para Uso Versátil | Micro Retifica | Retifica;mercadolivre.com.br;Promobit;R$138,47;True;True;23a84c6eafd1ea8ef86deed90ef670e21084733147a4c0bec10d7be05676d903
Tênis Olympikus Sonoro 3 - Masculino Tam 39;mercadolivre.com.br;Promobit;R$126,64;True;True;6af3c2b850f0383ff04c77b03ce464c74b3950571063bdaff8c21b56197689bb
Estreia mundial Versão global Xiaomi Redmi Note 14 MediaTek Helio G99-Ultra 108MP AI Camera 5500mAh 6,67" 120Hz T;aliexpress.com;Promobit;R$992,68;True;True;cd6edc8776ead51cc09f53f8747ff5c630105b177ef18bc6256af9dab19af238
Aparador de Grama Tramontina AP1000T 1000W;magazineluiza.com.br;Promobit;R$232,74;True;True;13a340e235cadf095944c41e5ab16db064535c596fb02af7fa30fd5dfa5dc328
📱 Smartphone Teste Shopee;Shopee;product_scraper_ultimate;R$ 599,99;True;True;835a11cfad316b65d18b3b2af2a371cc5ef1908dcde2ca4b1cab920ace73b028
